POY-2014-090.JPG	news, people	Seven friends came to Dia de Muertos at Seattle Center in their quinceanera dresses, including Cassandra Bermudez, left, Joanna Michelle Martinez Navarrete, Gabriela Sanchez and Kelly Martinez   (reflected in mirror) as they paint their faces in traditional masks to mark the Day of the Dead on Nov. 1. The event celebrated Latino art, culture and spirituality for departed family members, loved ones and connecting to their spirit.  	Alan Berner	0431260972	5101	3206
POY-2014-091.JPG	news	Supporters of Initiative 594, which expands background checks of gun sales, celebrate at a campaign and victory party at The Edgewater Hotel in Seattle as initial results are released on election night, Nov. 4. 	Alan Berner	0431312828	5129	3181
POY-2014-097.JPG	sports, sounders, people	Obafemi Martins, a forward for Seattle Sounders FC, is a native of Nigeria and has played soccer all over the world during his career. This portrait was made Nov. 6.	BETTINA HANSEN	0431313628	5760	3840
POY-2014-092.JPG	sports, preps	The Auburn Riverside Ravens celebrate narrowly winning their second set against Columbia River High to tie the championship match during the Class 3A District 3/4 volleyball tournament at Auburn Mountainview High School on Nov. 8. Auburn Riverside won three sets out of five over Columbia River to win the championship match.  	LINDSEY WASSON	0431333824	4349	2889
POY-2014-098.JPG	nature	A line of trumpeter swans flies past Mount Baker on Nov. 12. Wiser Lake, 3 miles southwest of Lynden, Whatcom County, is a major roosting area for the swans. They arrive around dusk after feeding in nearby agricultural fields during the day.	Mark Harrison	0431387976	5184	3456
POY-2014-093.JPG	sports, mariners	Seattle Mariners pitcher Felix Hernandez, with his son Jeremy, 5, who picked up a reporter's recorder, reacts to losing Cy Young Award to Corey Kluber of Cleveland Indians on November 12, 2014, in Seattle.  	Ken Lambert	0431368546	5136	3218
POY-2014-031.JPG	people	Sylvia Friedman is one-half of Duo Rose, the acrobatic trapeze act she performs with her husband, Samuel Sion. The two are based in Kassel, Germany, and originally from Chicago. This portrait was made March 26 at the 11th annual Moisture Festival at Hale's Palladium in Seattle's Fremont neighborhood.	BETTINA HANSEN	0428760329	4881	6101
POY-2014-094.JPG	news	Help is on the way for Yogi Bear as the pit bull-boxer mix with a cut paw is restrained Nov. 22 by Laura Audette, left, Dr. Heather Fowler and owner Marcie Hood as homeless and low-income pet owners receive free and volunteered care through the Doney Memorial Pet Clinic open twice a month at the Union Gospel Mission in Seattle. 	Alan Berner	0431499842	4660	3088
POY-2014-095.JPG	news	About 100 people gathered at Westlake Park as the Ferguson, Mo. grand jury decision was announced then took to the streets in protest November 24, 2014. After the announcement they laid down in the street for a moment of silence. 	Mark Harrison	0431524765	2400	1600
POY-2014-096.JPG	sports, UW	Budda Baker of the University of Washington Huskies jars the ball loose from receiver Dom Williams of the Washington State Cougars on what could have been a touchdown pass in the annual Apple Cup, on a frigid Nov. 29 night. The Huskies won 31-13.	DEAN RUTZ	0431587507	4356	3211
